{
  "code": 200,
  "status": 20000,
  "data": {
    "links": {
      "Follow us on LinkedIn": "https://www.linkedin.com/company/graphwise/",
      "Ontotext": "https://www.ontotext.com/",
      "Semantic Web Company": "https://semantic-web.com/",
      "PoolParty": "https://www.poolparty.biz/",
      "GraphDB": "https://www.ontotext.com/products/graphdb/",
      "": "https://enterprise-knowledge.com/",
      "Graphwise for M365": "https://graphwise.ai/microsoft-365-integration/",
      "Events & Webinars": "https://graphwise.ai/events/",
      "Resources": "https://graphwise.ai/resources/",
      "Blog": "https://graphwise.ai/blog/",
      "News": "https://graphwise.ai/news/",
      "Media Kit": "https://graphwise.ai/graphwise-media-kit/",
      "Factsheet": "https://graphwise.ai/wp-content/uploads/2024/10/Graphwise-Factsheet.pdf",
      "In the Press": "https://graphwise.ai/press/",
      "Contact": "https://graphwise.ai/contact/",
      "Download File: https://graphwise.ai/wp-content/uploads/2024/10/graphwise-video-background.mp4": "https://graphwise.ai/wp-content/uploads/2024/10/graphwise-video-background.mp4",
      "Download File: https://graphwise.ai/wp-content/uploads/2024/10/graphwise-video-background.webm": "https://graphwise.ai/wp-content/uploads/2024/10/graphwise-video-background.webm",
      "https://graphwise.ai/wp-content/uploads/2024/10/Graphwise-Podcast.mp3": "https://graphwise.ai/wp-content/uploads/2024/10/Graphwise-Podcast.mp3",
      "Graphwise platform": "https://graphwise.ai/wp-content/uploads/2024/10/Graphwise-Platform-leaflet.pdf",
      "Register now": "https://graphwise.ai/event/empowering-llm-semantic-layer/",
      "Press Release": "https://graphwise.ai/graphwise-press-release-general/",
      "Graphwise Company Factsheet": "https://graphwise.ai/graphwise-factsheet//",
      "Imprint": "https://graphwise.ai/imprint/",
      "FAQ": "https://graphwise.ai/faq/",
      "Privacy Policy": "https://graphwise.ai/privacy-policy/"
    },
    "title": "Home - Graphwise",
    "description": "Graphwise combines the expertise of Ontotext and Semantic Web Company to provide a trusted solution in graph and AI technologies.",
    "url": "https://graphwise.ai/",
    "content": "Home - Graphwise\n===============\n                                  \n\nCookie settings\n\n*   [Follow us on LinkedIn](https://www.linkedin.com/company/graphwise/ \"Click here to follow us on LinkedIn\")\n\n*   [Ontotext](https://www.ontotext.com/)\n*   [Semantic Web Company](https://semantic-web.com/)\n*   [PoolParty](https://www.poolparty.biz/)\n*   [GraphDB](https://www.ontotext.com/products/graphdb/)\n\n[![Image 1: Graphwise](https://graphwise.ai/wp-content/uploads/2024/10/graphwise-logo-horizontal-slogan.svg)](https://graphwise.ai/)\n\n*   Solutions\n    *   [Graphwise for M365](https://graphwise.ai/microsoft-365-integration/)\n*   [Events & Webinars](https://graphwise.ai/events/)\n*   [Resources](https://graphwise.ai/resources/)\n*   [Blog](https://graphwise.ai/blog/)\n*   Press Room\n    *   [News](https://graphwise.ai/news/)\n    *   [Media Kit](https://graphwise.ai/graphwise-media-kit/)\n    *   [Factsheet](https://graphwise.ai/wp-content/uploads/2024/10/Graphwise-Factsheet.pdf)\n    *   [In the Press](https://graphwise.ai/press/)\n*   [Contact](https://graphwise.ai/contact/)\n\nSelect Page\n\nVideo Player\n\n \n\nMedia error: Format(s) not supported or source(s) not found\n\n[Download File: https://graphwise.ai/wp-content/uploads/2024/10/graphwise-video-background.mp4](https://graphwise.ai/wp-content/uploads/2024/10/graphwise-video-background.mp4)[Download File: https://graphwise.ai/wp-content/uploads/2024/10/graphwise-video-background.webm](https://graphwise.ai/wp-content/uploads/2024/10/graphwise-video-background.webm)\n\n00:00\n\n00:00\n\n00:00\n\n[Use Up/Down Arrow keys to increase or decrease volume.](javascript:void(0);)\n\nBringing confidence to AI\n=========================\n\nSemantic Web Company and Ontotext have joined forces to become Graphwise\n\n![Image 2](https://graphwise.ai/wp-content/uploads/2024/10/graphwise-icon-3.png)\n\nEnhance AI Performance\n----------------------\n\nWe improve the accuracy and reliability of your AI models by leveraging our graph engine’s ability to analyze complex relationships and apply semantic reasoning.\n\n![Image 4](https://graphwise.ai/wp-content/uploads/2024/10/graphwise-icon-2.png)\n\nAddress LLM Hallucinations\n--------------------------\n\nWe overcome the limitations of Generative AI and large language models (LLMs) by incorporating unstructured and semi-structured data into your data using our knowledge graph fabric processes.\n\n![Image 6](https://graphwise.ai/wp-content/uploads/2024/10/graphwise-icon-1.png)\n\nLeverage Intelligent Applications\n---------------------------------\n\nWe develop innovative applications like Graph RAG, virtual assistants, and question answering systems to streamline processes and improve customer experiences.\n\n![Image 8](https://graphwise.ai/wp-content/uploads/2024/10/graphwise-icon-4.png)\n\nGet Accurate Search and Recommendation\n--------------------------------------\n\nWe develop more accurate and personalized recommendation systems for various industries, driving customer satisfaction and engagement.\n\nUnlocking information value with the most powerful AI\n-----------------------------------------------------\n\nThere is so much untapped knowledge in an organization’s unstructured data that is now becoming accessible with new AI models. However, the first attempts still had significant deficits that culminated in machines with inaccurate and unreliable output.\n\nKnowledge graphs are now the last piece of the AI puzzle and we’re excited to enable enterprises across the globe to truly reap the results and return on their AI investment.\n\n### Podcast\n\nAudio Player\n\n[https://graphwise.ai/wp-content/uploads/2024/10/Graphwise-Podcast.mp3](https://graphwise.ai/wp-content/uploads/2024/10/Graphwise-Podcast.mp3)\n\n00:00\n\n00:00\n\n00:00\n\n[Use Up/Down Arrow keys to increase or decrease volume.](javascript:void(0);)\n\n[Graphwise platform](https://graphwise.ai/wp-content/uploads/2024/10/Graphwise-Platform-leaflet.pdf)\n\nA vision for Graph AI\n---------------------\n\nAtanas Kiryakov and Andreas Blumauer on why their two companies are joining forces to form Graphwise.\n\nlive webinar\n\nEmpowering LLMs with a Semantic Layer\n-------------------------------------\n\nHarnessing the Power of a Semantic Layer to Elevate your LLM\n\n\n\nMarch 13, 2025 | 8:00 PM – 9:00 PM CET\n\n[Register now](https://graphwise.ai/event/empowering-llm-semantic-layer/)\n\n004\n\nDay\n\n:\n\n13\n\nHrs\n\n:\n\n01\n\nMin\n\n:\n\n13\n\nSec\n\n![Image 10: Andreas Blumauer](blob:https://graphwise.ai/70ce6aee2bbba07f009d5712cad469ab)\n\n### Andreas Blumauer\n\nSenior VP Growth, Graphwise\n\nAdvanced AI that meets the needs of the market\n----------------------------------------------\n\nGraph technology has found its perfect match: Generative AI. Only with the knowledge from the graph is AI now complete. This means more accuracy, more complete transparency, better decisions, less risk and, for the first time, a mature AI for your company.\n\n![Image 12](blob:https://graphwise.ai/b5e35919b00af9f5e1474bb26aaf2bc0)\n\n![Image 14](blob:https://graphwise.ai/b5e35919b00af9f5e1474bb26aaf2bc0)\n\nSolutions that are ahead of the curve\n-------------------------------------\n\nAI is evolving rapidly but Graphwise has the human resources to keep pace and lead the way. Benefit from products and services developed by the leaders in graph technology and AI. We have twenty years of software development experience at your service.\n\nA combined offering for enterprises based on two leading vendors\n----------------------------------------------------------------\n\nIt is difficult for enterprise customers to navigate the fragmented market of graph and AI vendors and find solutions from a single source. That’s why we took the next step and consolidated our offerings. We are now one of the top 3 vendors and can offer you a single source solution that fits your size.\n\n![Image 16](blob:https://graphwise.ai/b5e35919b00af9f5e1474bb26aaf2bc0)\n\n![Image 18](blob:https://graphwise.ai/b5e35919b00af9f5e1474bb26aaf2bc0)\n\nOne-Stop-Shop for Graph AI\n--------------------------\n\nGraphwise has the platform and tools, the methodologies, and the people to deliver world-class end-to-end solutions to enterprises. Benefit from merged customer success teams that collaborate holistically on your use-cases and use their combined knowledge and integrated services to work faster for your success.\n\nScaled up for your benefit\n--------------------------\n\nGraphwise enters the arena of global players. New partnerships with the most important integrators and distributors strengthen the relevance and sustainability of Graphwise solutions. Our joint offering enables investment security from which every customer benefits.\n\n![Image 20](blob:https://graphwise.ai/b5e35919b00af9f5e1474bb26aaf2bc0)\n\n> … navigate the world of data with confidence …\n\nThis merger brings together two industry leaders to create one of the most comprehensive knowledge graph AI platforms in the world. By combining their expertise, Graphwise can help businesses unlock the full potential of their\n\nAI investments and navigate the complex world of data with confidence.”\n\nread more\n\nChristian DirschlChief Content Architect, Wolters Kluwer Germany\n\n[![Image 22: Wolters Kluwer](blob:https://graphwise.ai/8926269b42f3f03ae09104103f9180c5)](https://www.wolterskluwer.com/)\n\n> … more cohesive capabilities for our clients …\n\nAs the world’s leading consulting firm in Semantic Solutions, we consistently review the range of software provider’s capabilities and future plans in service of our clients. For nearly a decade, we’ve chosen to work with both\n\nSemantic Web Company and Ontotext, seeing the positive outcomes they’ve helped to deliver for our clients. As the industry is now converging around the concepts of enterprise AI and semantic layers, we are in complete support of this merger. In short, it means more cohesive capabilities for our clients, with a single, strong product roadmap and united vision for the future.\n\nread more\n\nJoseph HilgerChief Operating Officer , Enterprise Knowledge\n\n[![Image 24: Enterprise Knowledge](blob:https://graphwise.ai/e8a57f4972516a1d3218894eabc89576)](https://enterprise-knowledge.com/)\n\nContact Us\n----------\n\nInterested in driving growth? Have a general question? We're just an email away.\n\n### Graphwise New York\n\nOntotext  \nSelect Office Suites Flatiron  \n1115 Broadway, 16 Madison Square West  \nSuite 1200, New York, NY 10010, United States\n\n### Graphwise Sofia\n\nOntotext  \n111R Tsarigradsko Shosse  \nSynergy Tower, fl. 12  \nSofia 1784  \nBulgaria\n\n### Graphwise Vienna\n\nSemantic Web Company GmbH  \nNeubaugasse 1, Top 8  \n1070 Vienna  \nAustria\n\n### Graphwise Basel\n\nOntotext  \nSwitzerland Innovation Park  \nBasel Area  \nHegenheimermattweg 167A  \n4123 Allschwil,  \nSwitzerland\n\n### Graphwise London\n\nPoolParty Software Ltd  \n71-75 Shelton Street, Covent Garden  \nLondon WC2H9JQ  \nUnited Kingdom\n\n### Graphwise Boston\n\nSemantic Web Company, Inc.  \nOne Boston Place, Suite 2600  \nBoston, MA 02108  \nUnited States\n\n#### Resources\n\n*   [Graphwise Platform](https://graphwise.ai/wp-content/uploads/2024/10/Graphwise-Platform-leaflet.pdf)\n*   [Press Release](https://graphwise.ai/graphwise-press-release-general/)\n*   [Graphwise Company Factsheet](https://graphwise.ai/graphwise-factsheet//)\n*   [Media Kit](https://graphwise.ai/graphwise-media-kit/)\n*   [Podcast](https://graphwise.ai/wp-content/uploads/2024/10/Graphwise-Podcast.mp3)\n\nGraphwise enables organizations to unlock ROI for enterprise AI by delivering the most comprehensive and trusted industry solution in the field of knowledge graphs and semantic AI technologies. As enterprises pour millions into AI investment, Graphwise delivers the critical knowledge graph infrastructure to ensure enterprises are ready to realize the technology’s full potential, is trusted, and can be implemented at scale. Graphwise, which is the result of the merger between tech visionaries Ontotext and Semantic Web Company, has over 200 employees worldwide, with offices located across North America, Europe and APAC.\n\n[![Image 26: ontotext](blob:https://graphwise.ai/556bc7db62f6f2829162352da5e73f1d)](https://www.ontotext.com/)[![Image 28: Semantic Web Company](blob:https://graphwise.ai/c26ddae48799a69b6b05f2ebc2e86f19)](https://semantic-web.com/)[![Image 30: poolparty](blob:https://graphwise.ai/4d6133c7eaedb03b703b2dffa231e8bd)](https://www.poolparty.biz/)[![Image 32: graphdb](blob:https://graphwise.ai/dc76a8e8da1a9f2df69edc6172f54f60)](https://www.ontotext.com/products/graphdb/)\n\n*   [Imprint](https://graphwise.ai/imprint/)\n*   [FAQ](https://graphwise.ai/faq/)\n*   [Privacy Policy](https://graphwise.ai/privacy-policy/)",
    "usage": {
      "tokens": 2554
    }
  }
}