{
  "code": 200,
  "status": 20000,
  "data": {
    "links": {
      "": "https://www.trae.ai/home",
      "Docs": "https://docs.trae.ai/",
      "Community": "https://discord.gg/NV3MF24tAe",
      "Log in": "https://www.trae.ai/login?redirect_url=https://www.trae.ai/download",
      "⚡️ Claude 3.7 Sonnet is available now! ↗": "https://www.trae.ai/download",
      "Terms of Service": "https://www.trae.ai/terms-of-service",
      "Privacy Policy": "https://www.trae.ai/privacy-policy",
      "Feedback": "mailto:feedback@mail.trae.ai",
      "Twitter X ↗": "https://x.com/Trae_ai"
    },
    "title": "Trae - Ship Faster with Trae",
    "description": "Trae is an adaptive AI IDE that transforms how you work, collaborating with you to run faster.",
    "url": "https://www.trae.ai/",
    "content": "Trae - Ship Faster with Trae\n===============\n    \n\n[](https://www.trae.ai/home)[Docs](https://docs.trae.ai/)[Community](https://discord.gg/NV3MF24tAe)\n\n[Log in](https://www.trae.ai/login?redirect_url=https://www.trae.ai/download)Download\n\n[](https://www.trae.ai/home)\n\n[⚡️ Claude 3.7 Sonnet is available now! ↗](https://www.trae.ai/download)\n\nShip Faster with Trae\n\nTrae is an adaptive AI IDE that transforms how you work, collaborating with you to run faster.\n\nDownload Trae\n\n[See all download options](https://www.trae.ai/download)\n\nCollaboration = You & Trae\n\nTrae is your ideal development partner, seamlessly balancing human & AI capabilities. This dynamic collaboration ensures each task is handled by the most suitable agent, maximizing your productivity. \n\n\\# Builder\n\nChat to build a project faster\n\nIn Builder mode, Trae automatically breaks down and executes tasks, optimizing each step while letting you preview and control the process.\n\nYour browser does not support HTML5 video tags.\n\n\\# Multimodality\n\nUpload images to clarify requirements\n\nWith advanced multimodal capabilities, Trae understands your image uploads with precision, streamlining collaboration and boosting efficiency.\n\nYour browser does not support HTML5 video tags.\n\n\\# Context\n\nGet better results with full context\n\nTrae is designed to analyze your entire codebase, utilizing insights from your editor and terminal to understand your workflow better. This enables more precise code generation and tailored modifications to meet your specific needs.\n\nWorkspace\n\nFolder\n\nFiles\n\nCode\n\n···\n\nYour browser does not support HTML5 video tags.\n\n\\# Autocomplete\n\nBoost efficiency with smart completion\n\nTrae can seamlessly extend your code in real-time, intuitively predict your intended edits, and automatically apply the changes for you.\n\nYour browser does not support HTML5 video tags.\n\nLoved by Devs\n\nTrae is popular among developers worldwide.\n\n![Image 1: Md. Shah Paran](https://www.trae.ai/)\n\nMd. Shah Paran\n\nTrae’s seamless experience and intuitive design make it my top pick for creative projects. It’s a game changer that continuously boosts my productivity—highly recommended!\n\n![Image 2: Steve Morin](https://www.trae.ai/)\n\nSteve Morin\n\nLove how Trae accelerates my development and that of my teams.\n\n![Image 3: Aldino Kemal](https://www.trae.ai/)\n\nAldino Kemal\n\nTRAE, the real AI partner! It’s been such a huge help in getting my tasks done—no stress coding at all. Plus, I’ve got to say, this is the best code editor UI I’ve ever used!\n\n![Image 4: Alex](https://www.trae.ai/)\n\nAlex\n\nI just built a RAG app in under 30min using https://trae.ai and I did not write a single character of code.\n\n![Image 5: Carlos Nexans](https://www.trae.ai/)\n\nCarlos Nexans\n\n@trae\\_ai is definitely a game changer. It feels like you have a real assistant that does the heavy lifting for you. The UI stands out among other IDEs.\n\n![Image 6: MathiasClari](https://www.trae.ai/)\n\nMathiasClari\n\nI can’t imagine a day without@trae\\_ai! Its adaptive AI features have become essential to my coding routine, making development faster and more intuitive. Kudos to the team for this incredible tool!\n\n![Image 7: AlexS](https://www.trae.ai/)\n\nAlexS\n\nI'm experimenting with AI tools. I've built a full-fledged application in two weeks. I know there are tools that can build it with a prompt, but doing it incrementally feels more satisfying. @Trae\\_ai\n\n![Image 8: Ast JXS](https://www.trae.ai/)\n\nAst JXS\n\nTested multiple AI coding platforms and I have to say @Trae\\_ai has surpassed them all. Massive applause and respect for the effort!\n\n![Image 9: Miracleio✨](https://www.trae.ai/)\n\nMiracleio✨\n\n@Trae\\_ai is the most beautiful code editor I've ever used. And it works as well as it looks. It's by far my best VSCode replacement right now.\n\n![Image 10: 0xKerryu](https://www.trae.ai/)\n\n0xKerryu\n\nI am impressed with @Trae\\_ai . I’ve used competitors for a while now, I can confidently say Trae is my new favorite daily driver. Not only is it quick, it’s stylish! I love the way it looks, refreshing to work in and extremely responsive.\n\n![Image 11: Md. Shah Paran](https://www.trae.ai/)\n\nMd. Shah Paran\n\nTrae’s seamless experience and intuitive design make it my top pick for creative projects. It’s a game changer that continuously boosts my productivity—highly recommended!\n\n![Image 12: Steve Morin](https://www.trae.ai/)\n\nSteve Morin\n\nLove how Trae accelerates my development and that of my teams.\n\n![Image 13: Aldino Kemal](https://www.trae.ai/)\n\nAldino Kemal\n\nTRAE, the real AI partner! It’s been such a huge help in getting my tasks done—no stress coding at all. Plus, I’ve got to say, this is the best code editor UI I’ve ever used!\n\n![Image 14: Alex](https://www.trae.ai/)\n\nAlex\n\nI just built a RAG app in under 30min using https://trae.ai and I did not write a single character of code.\n\n![Image 15: Carlos Nexans](https://www.trae.ai/)\n\nCarlos Nexans\n\n@trae\\_ai is definitely a game changer. It feels like you have a real assistant that does the heavy lifting for you. The UI stands out among other IDEs.\n\n![Image 16: MathiasClari](https://www.trae.ai/)\n\nMathiasClari\n\nI can’t imagine a day without@trae\\_ai! Its adaptive AI features have become essential to my coding routine, making development faster and more intuitive. Kudos to the team for this incredible tool!\n\n![Image 17: AlexS](https://www.trae.ai/)\n\nAlexS\n\nI'm experimenting with AI tools. I've built a full-fledged application in two weeks. I know there are tools that can build it with a prompt, but doing it incrementally feels more satisfying. @Trae\\_ai\n\n![Image 18: Ast JXS](https://www.trae.ai/)\n\nAst JXS\n\nTested multiple AI coding platforms and I have to say @Trae\\_ai has surpassed them all. Massive applause and respect for the effort!\n\n![Image 19: Miracleio✨](https://www.trae.ai/)\n\nMiracleio✨\n\n@Trae\\_ai is the most beautiful code editor I've ever used. And it works as well as it looks. It's by far my best VSCode replacement right now.\n\n![Image 20: 0xKerryu](https://www.trae.ai/)\n\n0xKerryu\n\nI am impressed with @Trae\\_ai . I’ve used competitors for a while now, I can confidently say Trae is my new favorite daily driver. Not only is it quick, it’s stylish! I love the way it looks, refreshing to work in and extremely responsive.\n\n![Image 21: sapienapp](https://www.trae.ai/)\n\nsapienapp\n\nTrae is hands down my favorite AI IDE—smarter, sleeker, and outpacing Cursor and Windsurf every time. Just waiting on those model settings for new and local models to unlock its full potential. Ps: Love the UI/UX\n\n![Image 22: Nikita Kakuev](https://www.trae.ai/)\n\nNikita Kakuev\n\nYou know what, @Trae\\_ai is my best mate now! He's teaching me Rust and it's the best experience I've had so far with AIs!\n\n![Image 23: György Márk Varga](https://www.trae.ai/)\n\nGyörgy Márk Varga\n\nI've been using @Trae\\_ai code edit since they launched. Wow, they have one of the greatest developer experience amongst IDEs and the productivity gain from the Builder mode really making me a 10x engineer. Great product.\n\n![Image 24: Vincent DELBEAU](https://www.trae.ai/)\n\nVincent DELBEAU\n\nTrae is an AI-powered code editor that stands out for its pleasant interface and responsive features. The Builder mode enables efficient development of complete projects.\n\n![Image 25: Colin](https://www.trae.ai/)\n\nColin\n\nTrae enhances coding efficiency with smart autocompletion, making development faster and smoother!\n\n![Image 26: Gary](https://www.trae.ai/)\n\nGary\n\nWriting code has never been that easier! Trae helps me generate efficient code on the fly. A game-changer!\n\n![Image 27: IndieMike](https://www.trae.ai/)\n\nIndieMike\n\nTrae is so freaking amazing that I'm starting to worry my job's gonna vanish into thin air.\n\n![Image 28: ChristineCT](https://www.trae.ai/)\n\nChristineCT\n\nIn terms of code generation speed, Trae is quite impressive when the network connection is good. It can quickly generate code snippets according to my requests, improving my productivity.\n\n![Image 29: newton_ls](https://www.trae.ai/)\n\nnewton\\_ls\n\nThe speed is quite fast. For the codes I can't understand, I just let AI translate it for me.\n\n![Image 30: James Conlon](https://www.trae.ai/)\n\nJames Conlon\n\nSwitching from VS Code to Trae is super smooth.\n\n![Image 31: sapienapp](https://www.trae.ai/)\n\nsapienapp\n\nTrae is hands down my favorite AI IDE—smarter, sleeker, and outpacing Cursor and Windsurf every time. Just waiting on those model settings for new and local models to unlock its full potential. Ps: Love the UI/UX\n\n![Image 32: Nikita Kakuev](https://www.trae.ai/)\n\nNikita Kakuev\n\nYou know what, @Trae\\_ai is my best mate now! He's teaching me Rust and it's the best experience I've had so far with AIs!\n\n![Image 33: György Márk Varga](https://www.trae.ai/)\n\nGyörgy Márk Varga\n\nI've been using @Trae\\_ai code edit since they launched. Wow, they have one of the greatest developer experience amongst IDEs and the productivity gain from the Builder mode really making me a 10x engineer. Great product.\n\n![Image 34: Vincent DELBEAU](https://www.trae.ai/)\n\nVincent DELBEAU\n\nTrae is an AI-powered code editor that stands out for its pleasant interface and responsive features. The Builder mode enables efficient development of complete projects.\n\n![Image 35: Colin](https://www.trae.ai/)\n\nColin\n\nTrae enhances coding efficiency with smart autocompletion, making development faster and smoother!\n\n![Image 36: Gary](https://www.trae.ai/)\n\nGary\n\nWriting code has never been that easier! Trae helps me generate efficient code on the fly. A game-changer!\n\n![Image 37: IndieMike](https://www.trae.ai/)\n\nIndieMike\n\nTrae is so freaking amazing that I'm starting to worry my job's gonna vanish into thin air.\n\n![Image 38: ChristineCT](https://www.trae.ai/)\n\nChristineCT\n\nIn terms of code generation speed, Trae is quite impressive when the network connection is good. It can quickly generate code snippets according to my requests, improving my productivity.\n\n![Image 39: newton_ls](https://www.trae.ai/)\n\nnewton\\_ls\n\nThe speed is quite fast. For the codes I can't understand, I just let AI translate it for me.\n\n![Image 40: James Conlon](https://www.trae.ai/)\n\nJames Conlon\n\nSwitching from VS Code to Trae is super smooth.\n\n![Image 41: IndieMike](https://www.trae.ai/)\n\nIndieMike\n\nTrae is so freaking amazing that I'm starting to worry my job's gonna vanish into thin air.\n\n![Image 42: James Conlon](https://www.trae.ai/)\n\nJames Conlon\n\nSwitching from VS Code to Trae is super smooth.\n\n![Image 43: Vincent DELBEAU](https://www.trae.ai/)\n\nVincent DELBEAU\n\nTrae is an AI-powered code editor that stands out for its pleasant interface and responsive features. The Builder mode enables efficient development of complete projects.\n\n![Image 44: Gary](https://www.trae.ai/)\n\nGary\n\nWriting code has never been that easier! Trae helps me generate efficient code on the fly. A game-changer!\n\n![Image 45: ChristineCT](https://www.trae.ai/)\n\nChristineCT\n\nIn terms of code generation speed, Trae is quite impressive when the network connection is good. It can quickly generate code snippets according to my requests, improving my productivity.\n\n![Image 46: Alex](https://www.trae.ai/)\n\nAlex\n\nI just built a RAG app in under 30min using https://trae.ai and I did not write a single character of code.\n\nGet Started for\n\n Free\n\nBe the first to try Trae and enjoy the completely free option among powerful AI coding tools now.\n\nDownload Trae\n\nCopyright © 2025. All rights reserved.\n\nSubscribe\n\nTerms\n\n[Terms of Service](https://www.trae.ai/terms-of-service)[Privacy Policy](https://www.trae.ai/privacy-policy)\n\nSupports\n\n[Feedback](mailto:feedback@mail.trae.ai)[Docs](https://docs.trae.ai/)\n\nEngage\n\n[Discord ↗](https://discord.gg/NV3MF24tAe)[Twitter X ↗](https://x.com/Trae_ai)\n\n ![Image 47](https://t.co/1/i/adsct?bci=4&dv=UTC%26en-US%26Google%20Inc.%26Linux%20x86_64%26255%26800%26600%264%2624%26800%26600%260%26na&eci=3&event=%7B%7D&event_id=d3b7cdf1-9b25-433d-b555-fed986d29b1f&integration=advertiser&p_id=Twitter&p_user_id=0&pl_id=8eadbff2-daa6-41bd-8e99-cb5f306ab7dd&tw_document_href=https%3A%2F%2Fwww.trae.ai%2F&tw_iframe_status=0&txn_id=p5hdg&type=javascript&version=2.3.31)![Image 48](https://analytics.twitter.com/1/i/adsct?bci=4&dv=UTC%26en-US%26Google%20Inc.%26Linux%20x86_64%26255%26800%26600%264%2624%26800%26600%260%26na&eci=3&event=%7B%7D&event_id=d3b7cdf1-9b25-433d-b555-fed986d29b1f&integration=advertiser&p_id=Twitter&p_user_id=0&pl_id=8eadbff2-daa6-41bd-8e99-cb5f306ab7dd&tw_document_href=https%3A%2F%2Fwww.trae.ai%2F&tw_iframe_status=0&txn_id=p5hdg&type=javascript&version=2.3.31)",
    "usage": {
      "tokens": 3515
    }
  }
}