{
  "code": 200,
  "status": 20000,
  "data": {
    "links": {
      "": "https://www.verse.com/",
      "Log In": "https://www.verse.com/accounts/login/",
      "Get Started": "https://www.verse.com/contact",
      "Explore more case studies": "https://www.verse.com/watch",
      "Learn more": "https://www.verse.com/news/bts-interactive-film-puts-you-in-the-shoes-of-a-woman-juggling-babysitting-and-working-from-home/",
      "Watch our interactive guide": "https://www.verse.com/stories/56824-getting-started-with-the-verse-story-editor/?embed&chapterbuttons=0&playernav=0",
      "More": "https://www.verse.com/#",
      "Contact": "https://www.verse.com/contact/",
      "Pricing": "https://www.verse.com/pricing/",
      "Watch": "https://www.verse.com/watch/",
      "Documentation": "http://help.verse.com/",
      "Terms and Conditions": "https://www.verse.com/terms/",
      "Privacy Notice": "https://www.verse.com/privacy/"
    },
    "title": "Verse | Interactive Video",
    "description": "Create immersive interactive content with your videos.",
    "url": "https://www.verse.com/",
    "content": "Verse | Interactive Video\n===============              \n\n[![Image 1: Verse Logo](https://www.verse.com/wp-content/themes/verse_theme/dist/assets/images/icons/verse-logo.svg)](https://www.verse.com/)\n\n[Log In](https://www.verse.com/accounts/login/)\n\n[Get Started](https://www.verse.com/contact)\n\n### Free the story with Verse\n\nTransform your videos into immersive interactive experiences today.\n\n[Log In](https://www.verse.com/accounts/login/)\n\n[Get Started](https://www.verse.com/contact)\n\nCreate immersive interactive content with your videos\n=====================================================\n\nEnhance and enrich your story with elegant tools that empower audiences to truly engage.\n\n[Create with Verse](https://www.verse.com/contact)\n\n*   01 Entertainment Engage and delight viewers with immersive narratives that deliver truly unique experiences with infinite outcomes.\n*   02 Ecommerce Enhance your promotional videos with clickable hotspots for richer, more personalized shopping experiences that drive results.\n*   03 Experiential Elevate your product presentations with seamless transitions between narrative and navigation.\n*   04 Education Enrich your training and onboarding videos with dynamic decision points that boost retention and understanding.\n\n### Your content, connected.\n\nVerse transforms static, solitary videos into dynamic, connected experiences that invite exploration. Learn why the world’s best storytellers use Verse to create award-winning digital content.\n\n[Schedule a demo today](https://www.verse.com/contact)\n\nMade with Verse\n---------------\n\n#### Join the thousands of marketers, filmmakers, journalists and artists who rely on Verse to create engaging interactive experiences.\n\n[Explore more case studies](https://www.verse.com/watch)\n\n##### University of Chicago\n\n###### The Pearson Institute\n\n##### Deloitte Digital\n\n###### The Omnia Experience\n\n##### McClatchy\n\n###### Trump's Inner Circle: The Ties to Russia\n\n##### Ping Identity\n\n###### Break the IT Slow-Down Cycle\n\n##### Macy's\n\n###### Dazzling Dresses Trends\n\n##### NASA\n\n###### OSIRIS-Rex Instruments\n\n##### Village Roadshow Pictures\n\n###### Mile 22: Overwatch Challenge\n\n##### The British Council\n\n###### Exploring Creativity and Imagination\n\n##### Optum Health\n\n###### Day Zero\n\n##### GRX Immersive\n\n###### POV: Points of View\n\n##### PageSix\n\n###### How to Wear the Catsuit Trend Celebrities Love\n\n##### Schnitz\n\n###### Guests at Heart Training Video\n\n###### Spotlight on The Atlantic\n\n### The British Impact\n\nTo introduce Jaguar’s first SUV in the American market, The Atlantic’s branded content studio leveraged Verse to combine dozens of original content components into one seamless, interactive experience exploring Britain’s enduring impact on US cultural trends.\n\n[Learn more](https://www.verse.com/news/how-jaguar-used-interactive-video-to-launch-the-next-british-invasion/)\n\n###### Spotlight on British Telecom\n\n### Unstoppable\n\nBritish Telecom used Verse to put viewers in the shoes of a woman juggling babysitting and working from home. The choose-your-own-adventure campaign was recognized by AdAge, Marketing Communication News, Campaign UK and more.\n\n[Learn more](https://www.verse.com/news/bts-interactive-film-puts-you-in-the-shoes-of-a-woman-juggling-babysitting-and-working-from-home/)\n\nPrevious\n\nNext\n\n> Rarely do interactive content experiences feel this intuitive and flow so naturally, which is thanks in part to the use of Verse, an interactive video platform. After this series, I expect that we’ll start to see more top-tier publishers using their technology.\n\n##### Shawn Ragell\n\nPressboard on Jaguar’s Verse series The British Impact\n\n> If you're already shooting video, this is a no-brainer. I think the way we've always done video is like a hammer and chisel and we're carving hieroglyphics, and this is an entire toolbox of different things. It unlocks so many possibilities.\n\n##### Ren LaForme\n\nDigital Tools Journalist, The Poynter Institute\n\n> People were watching it for 20, 22, 25 minutes, which is insane. I’ve been doing video for newspapers and magazines for ten years, and we’re lucky if people are watching it after the first minute and a half. So right then, I was like, something special is happening here.\n\n##### Shaminder Dulai\n\nDirector of Photography at Newsweek on their Verse story Undertow\n\n*   1\n*   2\n*   3\n\nSimple tools. Incredible results.\n---------------------------------\n\n#### Easily create, publish and track your experiences with our browser-based story editor.\n\n[Watch our interactive guide](https://www.verse.com/stories/56824-getting-started-with-the-verse-story-editor/?embed&chapterbuttons=0&playernav=0)\n\n##### Clickable Hotspots\n\n##### Decision Points\n\n##### Interactive Explainers\n\n##### Multimedia Slideshows\n\n##### Mobile First Design\n\n##### Embeddable Everywhere\n\n##### Advanced Analytics\n\n##### Customizable Styles\n\n##### Multilingual Captioning\n\n##### 360 & Vertical Video\n\n##### Powerful APIs & Integrations\n\n##### Monetization Tools\n\n### We're more than a platform. We're a partner.\n\nNeed more help? Our award-winning creative teams can meet the demands of any story and help turn your vision into reality. Whether it's video and animation production or custom web development, we've got you covered.\n\n[Request a creative consultation](https://www.verse.com/contact)\n\n### Trusted by the world's best brands\n\nPBS Frontline Broadcast\n\nUniversity of Chicago Education\n\nThe Atlantic Publishing\n\nThe North Face Fashion\n\nMcClatchy Publishing\n\nBritish Council Education\n\nDeloitte Professional Services\n\nVillage Roadshow Pictures Entertainment\n\nBloomberg Publishing\n\nAT&T Communications\n\nJaguar Automotive\n\nPBS Frontline Broadcast\n\nUniversity of Chicago Education\n\nThe Atlantic Publishing\n\nThe North Face Fashion\n\nMcClatchy Publishing\n\nBritish Council Education\n\nDeloitte Professional Services\n\nVillage Roadshow Pictures Entertainment\n\nBloomberg Publishing\n\nAT&T Communications\n\nJaguar Automotive\n\nPBS Frontline Broadcast\n\nUniversity of Chicago Education\n\nThe Atlantic Publishing\n\nThe North Face Fashion\n\nMcClatchy Publishing\n\nBritish Council Education\n\n[More](https://www.verse.com/#)\n\n[More](https://www.verse.com/#)\n\nMaecenas tincidunt, velit ac porttitor pulvinar, tortor eros\n\nLorem ipsum dolor sit amet, consectetur adipisicing elit. Consequuntur excepturi odio ullam vel cumque magnam quae ut veritatis tempore!\n\nMake more engaging content with Verse\n-------------------------------------\n\nTransform your videos into immersive interactive experiences today.\n\n[Log In](https://www.verse.com/accounts/login/)\n\n[Get Started](https://www.verse.com/contact)\n\n[![Image 2: Verse Logo](https://www.verse.com/wp-content/themes/verse_theme/dist/assets/images/icons/verse-logo.svg)](https://www.verse.com/#)\n\n*   [Contact](https://www.verse.com/contact/)\n*   [Pricing](https://www.verse.com/pricing/)\n*   [Watch](https://www.verse.com/watch/)\n*   [Documentation](http://help.verse.com/)\n\n© 2025 Bonza Interactive Group, LLC. All rights reserved.\n\n*   [Terms and Conditions](https://www.verse.com/terms/)\n*   [Privacy Notice](https://www.verse.com/privacy/)",
    "usage": {
      "tokens": 1521
    }
  }
}