{
  "code": 200,
  "status": 20000,
  "data": {
    "links": {
      "F5-TTS": "https://f5tts.org/",
      "F5 TTS": "https://f5tts.org/playground",
      "Kokoro TTS": "https://f5tts.org/kokorotts",
      "Acapella Extractor": "https://f5tts.org/acapella-extractor",
      "support@f5tts.org": "https://f5tts.org/#",
      "Privacy": "https://f5tts.org/privacy",
      "Terms": "https://f5tts.org/terms",
      "Change Clothes AI": "https://changeclothesai.org/",
      "OmniHuman": "https://omnihuman.design/"
    },
    "title": "F5-TTS | Free Online AI Text-to-Speech Synthesis Tool",
    "description": "F5-TTS is a free online real-time text-to-speech synthesis tool that leverages AI to generate natural and expressive speech from text input.",
    "url": "https://f5tts.org/",
    "content": "F5-TTS | Free Online AI Text-to-Speech Synthesis Tool\n===============\n\n[![Image 1: logo](https://f5tts.org/logo.svg)F5-TTS](https://f5tts.org/en)\n\n[Home](https://f5tts.org/en)[F5 TTS](https://f5tts.org/playground)[Kokoro TTS](https://f5tts.org/kokorotts)[Acapella Extractor](https://f5tts.org/acapella-extractor)\n\nEnglish\n\nOpen menu\n\nF5-TTS\n======\n\nExperience the power of advanced text-to-speech synthesis with F5-TTS. Transform your text into natural, expressive speech with precision and ease using our cutting-edge AI technology. F5-TTS offers zero-shot voice cloning, multi-language support, and emotion expression capabilities.\n\n[Try F5-TTS](https://f5tts.org/playground)[Try Kokoro TTS](https://f5tts.org/kokorotts)\n\n![Image 2: User 1](https://f5tts.org/_next/image?url=%2Fimages%2Favatar-1.png&w=64&q=75)![Image 3: User 2](https://f5tts.org/_next/image?url=%2Fimages%2Favatar-2.png&w=64&q=75)![Image 4: User 3](https://f5tts.org/_next/image?url=%2Fimages%2Favatar-3.png&w=64&q=75)![Image 5: User 4](https://f5tts.org/_next/image?url=%2Fimages%2Favatar-4.png&w=64&q=75)\n\n★★★★★\n\nfrom 2k+ reviews\n\n![Image 6: F5-TTS](https://f5tts.org/_next/image?url=%2Fimages%2Ff5-tts.webp&w=1200&q=75)\n\n3 Simple Steps\n\nHow to Use F5-TTS\n-----------------\n\nGenerate high-quality speech effortlessly with F5-TTS AI-powered text-to-speech synthesis. Follow these steps to create natural and expressive audio from your text input in real time.\n\n### Step 1: Upload Audio\n\nBegin by clicking the 'Upload Audio' button to provide a reference audio file. F5-TTS will use this audio for voice cloning, allowing you to generate speech that mimics the voice in your uploaded file. For best results, use a clear, high-quality audio recording of the desired voice. This step enables F5-TTS to perform its zero-shot voice cloning, a key feature that sets it apart from other TTS systems.\n\n### Step 2: Upload Text Content\n\nNext, click on 'Upload Text' to input the content you want to convert to speech. F5-TTS accepts various text formats, including plain text and formatted documents. Ensure your text is clear and properly formatted for optimal results. If you're using F5-TTS's multi-language support, make sure to specify the language of your text input.\n\n### Step 3: Synthesize and Download\n\nAfter uploading your audio and text, simply click the 'Synthesize' button. F5-TTS will process your input using its advanced AI algorithms, including Flow Matching and Diffusion Transformer techniques. Once the synthesis is complete, you can preview the generated speech directly in your browser. If you're satisfied with the result, click the 'Download' button to save the high-quality audio file.\n\nFeatures\n\nWhy Choose F5-TTS?\n------------------\n\nF5-TTS redefines text-to-speech synthesis with AI-driven technology, offering natural speech generation, real-time processing, and broad versatility for various applications.\n\n### Advanced AI Speech Synthesis\n\nLeverage F5-TTS's cutting-edge AI to seamlessly convert text into natural-sounding speech. The intelligent algorithms ensure accurate, lifelike vocal productions, allowing for highly detailed and expressive audio output that brings your text to life.\n\n### Zero-Shot Voice Cloning\n\nF5-TTS provides instant voice cloning capabilities without the need for extensive training data. Quickly create different voices and accents, enabling a diverse range of speech outputs for various characters or scenarios, making your workflow efficient and versatile.\n\n### Multi-Language Support\n\nAchieve stunning, high-quality results with F5-TTS in multiple languages, including English and Chinese. Whether you're working on global projects or multilingual content, F5-TTS adapts to deliver clear and natural speech across different languages.\n\n### Emotion Expression and Speed Control\n\nF5-TTS is ideal for creating emotive audio content, offering control over speech emotions and speed. Its ability to transform static text into dynamic, expressive speech makes it a valuable tool for professionals in various fields, from content creation to e-learning.\n\nFAQs\n\nFrequently Asked Questions\n--------------------------\n\nFind answers to the most common questions about F5-TTS, the AI-powered text-to-speech synthesis tool.\n\n### What is F5-TTS?\n\nF5-TTS is an AI-powered text-to-speech synthesis tool that converts text into natural-sounding speech. It offers real-time processing, making it ideal for creating dynamic audio content, voice-overs, and digital narratives.\n\n### How does F5-TTS work?\n\nF5-TTS uses advanced AI algorithms, including Flow Matching and Diffusion Transformer techniques, to generate speech from text input. It processes the text and creates natural-sounding audio without the need for traditional components like phoneme alignment or duration prediction.\n\n### What audio quality does F5-TTS support?\n\nF5-TTS supports high-quality audio outputs, with generated speech maintaining natural intonation and clarity. This makes it suitable for projects requiring professional-grade audio, from podcasts to audiobooks and e-learning materials.\n\n### Can F5-TTS be used for voice-over production?\n\nYes, F5-TTS is excellent for voice-over production. Its zero-shot voice cloning capability allows you to create diverse voices for different characters or narrators, while its emotion expression feature adds depth to the audio content.\n\n### Does F5-TTS support real-time processing?\n\nYes, F5-TTS offers efficient real-time processing thanks to its Sway Sampling strategy. This makes it suitable for applications requiring quick speech generation, such as virtual assistants or interactive voice response systems.\n\n### Is there a way to fine-tune the speech output in F5-TTS?\n\nNo, F5-TTS does not offer fine-tuning options. In the future, we will add more advanced features to allow users to fine-tune the speech output.\n\nCan't find the answer you're looking for? Contact our support team: [support@f5tts.org](https://f5tts.org/#)\n\nTestimonials\n\nWhat Our Users Say About F5-TTS\n-------------------------------\n\nOur users love F5-TTS! Discover how this AI-powered text-to-speech tool has significantly enhanced their audio projects and workflows, delivering stunning results that meet diverse needs.\n\n![Image 7: Avatar of Sarah Collins](https://f5tts.org/_next/image?url=%2Fimages%2Favatar-1.png&w=96&q=75)\n\nSarah Collins\n\nAudiobook Producer\n\n> \"F5-TTS has completely transformed the way I approach audiobook production. The natural-sounding voices and emotion expression capabilities allow me to create engaging narrations effortlessly. The zero-shot voice cloning feature is a game-changer, enabling me to produce diverse character voices without the need for multiple voice actors. F5-TTS has not only improved the quality of my audiobooks but also streamlined my production process significantly.\"\n> \n> #AudiobookProduction\n\n![Image 8: Avatar of Jason Mitchell](https://f5tts.org/_next/image?url=%2Fimages%2Favatar-2.png&w=96&q=75)\n\nJason Mitchell\n\nE-Learning Developer\n\n> \"Incorporating F5-TTS into my e-learning content development has been revolutionary. Its speed and natural speech output allow me to quickly create voice-overs for educational modules in multiple languages. The real-time processing helps me fine-tune the narration, ensuring that the final audio captures the right tone and pacing for effective learning. It has not only enhanced the quality of our courses but also boosted our content production efficiency.\"\n> \n> #ELearningAudio\n\n![Image 9: Avatar of Priya Kapoor](https://f5tts.org/_next/image?url=%2Fimages%2Favatar-3.png&w=96&q=75)\n\nPriya Kapoor\n\nMarketing Specialist\n\n> \"F5-TTS has made our marketing campaigns far more dynamic and personalized. We can easily generate voice-overs in different languages, adjust emotional tones, and even create custom voices that align with our brand identity. The flexibility it provides in quickly adapting audio content to different campaign needs makes it an indispensable tool for any marketing team looking to add a more engaging auditory dimension to their content.\"\n> \n> #MarketingAudio\n\n![Image 10: Avatar of Olivia Thompson](https://f5tts.org/_next/image?url=%2Fimages%2Favatar-4.png&w=96&q=75)\n\nOlivia Thompson\n\nPodcast Producer\n\n> \"Using F5-TTS has greatly improved my podcast production workflow. The ability to generate natural-sounding speech from scripts saves me countless hours of recording and editing. I can experiment with different voices and emotional tones to create engaging content that resonates with listeners. F5-TTS has allowed me to focus more on crafting compelling stories and less on the technical aspects of voice production.\"\n> \n> #PodcastProduction\n\n![Image 11: Avatar of Daniel Reyes](https://f5tts.org/_next/image?url=%2Fimages%2Favatar-5.png&w=96&q=75)\n\nDaniel Reyes\n\nGame Developer\n\n> \"As a game developer, I found F5-TTS to be the most versatile text-to-speech tool I've used. Its real-time processing and detailed control over voice characteristics allow for a wide range of character voices and dialogues. I enjoy experimenting with different emotions and accents, and F5-TTS makes it easy to create immersive audio experiences for our games without the need for extensive voice actor recordings.\"\n> \n> #GameAudio\n\n![Image 12: Avatar of Grace Foster](https://f5tts.org/_next/image?url=%2Fimages%2Favatar-6.png&w=96&q=75)\n\nGrace Foster\n\nAccessibility Consultant\n\n> \"F5-TTS has been an invaluable tool for our accessibility projects, allowing us to create high-quality audio versions of written content quickly and efficiently. The natural-sounding speech and multi-language support mean we can provide accessible materials for diverse audiences. It has added a new level of inclusivity to our clients' digital content, making information more readily available to those with visual impairments or reading difficulties.\"\n> \n> #AccessibleAudio\n\nExperience F5-TTS Now!\n----------------------\n\nExplore the power of F5-TTS AI to transform your text into natural, expressive speech. Join thousands of satisfied users and elevate your audio content today.\n\n[Get Started](https://f5tts.org/playground)\n\nFooter\n\n[![Image 13: logo](https://f5tts.org/logo.svg)F5-TTS](https://f5tts.org/)\n\nsupport@f5tts.org\n\nCompany\n\n*   [Home](https://f5tts.org/)\n*   [Blog](https://f5tts.org/)\n\nLegal\n\n*   [Privacy](https://f5tts.org/privacy)\n*   [Terms](https://f5tts.org/terms)\n\nProduct\n\n*   [Change Clothes AI](https://changeclothesai.org/)\n*   [OmniHuman](https://omnihuman.design/)\n\n© 2025 F5-TTS. All rights reserved.",
    "usage": {
      "tokens": 2453
    }
  }
}