{
  "code": 200,
  "status": 20000,
  "data": {
    "links": {
      "": "https://multitaskai.com/",
      "Pricing": "https://multitaskai.com/pricing/",
      "App": "https://app.multitaskai.com/",
      "Account": "https://multitaskai.com/login/",
      "Docs": "https://multitaskai.com/docs/",
      "Get Started": "https://earlybird.so/products/multitaskai/",
      "Multitasking": "https://multitaskai.com/#multitasking",
      "Models": "https://multitaskai.com/#models",
      "API Keys": "https://multitaskai.com/#api-keys",
      "Context": "https://multitaskai.com/#context",
      "Vision": "https://multitaskai.com/#vision",
      "Whisper": "https://multitaskai.com/#whisper",
      "PWA": "https://multitaskai.com/#pwa",
      "Sync": "https://multitaskai.com/#sync",
      "Prompts": "https://multitaskai.com/#prompts",
      "Inline Generation": "https://multitaskai.com/#inline-generation",
      "Languages": "https://multitaskai.com/#languages",
      "Self-host": "https://multitaskai.com/#self-host",
      "Features": "https://multitaskai.com/#features",
      "Buy": "https://multitaskai.com/#buy",
      "Roadmap": "https://multitaskai.com/#roadmap",
      "FAQ": "https://multitaskai.com/#faq",
      "hi@multitaskai.com": "mailto:hi@multitaskai.com",
      "Legal": "https://multitaskai.com/legal/",
      "Blog": "https://multitaskai.com/blog/",
      "Redeem Code": "https://multitaskai.com/redeem-code/",
      "The Ultimate ChatGPT Alternative (2025)": "https://multitaskai.com/chatgpt-alternative/",
      "The Ultimate Claude Alternative (2025)": "https://multitaskai.com/claude-alternative/",
      "The Ultimate Google Gemini Alternative (2025)": "https://multitaskai.com/google-gemini-alternative/",
      "The Best Self-hosted ChatGPT Alternative (2025)": "https://multitaskai.com/self-hosted-chatgpt/",
      "The Best Self-hosted Claude Alternative (2025)": "https://multitaskai.com/self-hosted-claude/",
      "The Best Self-hosted Google Gemini Alternative (2025)": "https://multitaskai.com/self-hosted-google-gemini/",
      "dennn.is": "https://dennn.is/",
      "üîÆBlockstudioThe block framework for WordPress": "https://blockstudio.dev/",
      "ü•∑SleekWPComprehensive product suite for WordPress": "https://sleekwp.com/",
      "‚ùáÔ∏èOneClick ProThe ultimate collection of single-click tools": "https://oneclick.pro/",
      "üí†KickstartUIYour ultimate guide to the best UI tools": "https://kickstartui.com/",
      "üç©GlazeUtility-based animation framework for the web": "https://glaze.dev/"
    },
    "title": "MultitaskAI - The Custom Chat UI for OpenAI, Anthropic, Google Gemini, and Top AI Models",
    "description": "Chat seamlessly with AI models like OpenAI, Anthropic, and Google Gemini using MultitaskAI, a custom-built interface designed for split-screen multitasking, side-by-side comparisons, and smarter workflows.",
    "url": "https://multitaskai.com/",
    "content": "MultitaskAI - The Custom Chat UI for OpenAI, Anthropic, Google Gemini, and Top AI Models\n===============\n\n[![Image 1: logo](https://multitaskai.com/images/logo.svg)](https://multitaskai.com/)\n\nToggle theme\n\n[Pricing](https://multitaskai.com/pricing/)[App](https://app.multitaskai.com/)[Account](https://multitaskai.com/account/)[Docs](https://multitaskai.com/docs/)\n\n[Get Started](https://earlybird.so/products/multitaskai/)\n\n[Multitasking](https://multitaskai.com/#multitasking)[Models](https://multitaskai.com/#models)[API Keys](https://multitaskai.com/#api-keys)[Context](https://multitaskai.com/#context)[Vision](https://multitaskai.com/#vision)[Whisper](https://multitaskai.com/#whisper)[PWA](https://multitaskai.com/#pwa)[Sync](https://multitaskai.com/#sync)[Prompts](https://multitaskai.com/#prompts)[Inline Generation](https://multitaskai.com/#inline-generation)[Languages](https://multitaskai.com/#languages)[Self-host](https://multitaskai.com/#self-host)[Features](https://multitaskai.com/#features)[Buy](https://multitaskai.com/#buy)[Roadmap](https://multitaskai.com/#roadmap)[FAQ](https://multitaskai.com/#faq)\n\nA unified, intuitive chat UI for OpenAI Anthropic Google Gemini and other leading AI models\n===========================================================================================\n\n*   Bring your own API keys\n*   Ô∏èKeep your data private\n*   Split-screen multitasking\n*   Switch between models\n*   Upload and parse files\n*   Queue requests\n*   Settings per model\n*   Be quick with shortcuts\n*   Use online or self-host\n*   Offline support (PWA)\n*   Fast and lightweight app\n*   Light and dark mode\n\n[Get MultitaskAI](https://earlybird.so/products/multitaskai/)‚ôæÔ∏è Lifetime License\n\n[Go to App](https://app.multitaskai.com/)\n\nChatChat seamlessly with leading models using their APIs.MultitaskCompare models side-by-side in a split-screen view.FilesUpload files, extract content and use in chats.AgentsCreate and manage custom AI agents with custom data.\n\n![Image 2: chat](https://multitaskai.com/_next/image/?url=%2Fscreenshots%2Fchat-light.png&w=3840&q=75)![Image 3: chat](blob:https://multitaskai.com/46f1166894a895beb7745e93906e2ce9)\n\n![Image 4: split screen chat](https://multitaskai.com/_next/image/?url=%2Fscreenshots%2Fsplit-screen-light.png&w=3840&q=75)![Image 5: split screen chat](blob:https://multitaskai.com/46f1166894a895beb7745e93906e2ce9)\n\n![Image 6: files](https://multitaskai.com/_next/image/?url=%2Fscreenshots%2Ffiles-light.png&w=3840&q=75)![Image 7: files](blob:https://multitaskai.com/46f1166894a895beb7745e93906e2ce9)\n\n![Image 8: chat](https://multitaskai.com/_next/image/?url=%2Fscreenshots%2Fagents-light.png&w=3840&q=75)![Image 9: chat](blob:https://multitaskai.com/46f1166894a895beb7745e93906e2ce9)\n\nTrue multitasking with features you've been longing for\n-------------------------------------------------------\n\nEffortlessly manage your conversations with powerful tools designed to enhance productivity and streamline your workflow.\n\nFetching User by Email in Supabase\n\nConvert JavaScript Array to TypeScript Tuple\n\n### Background Completions\n\nContinue to your next chat while existing conversations complete their responses in the background.\n\nSent after completion:\n\nCan you generate another example pleasePlease rewrite the code to use TypeScript\n\n### Queue requests\n\nQueue up your next message while a response is being completed. Messages will be sent automatically once the current response is finished.\n\nNew chat from here\n\nNew split-screen from here\n\nRegenerate from here\n\n### Fork Conversations\n\nStart a new chat or open a split-screen view to explore different directions in the conversation simultaneously.\n\nPick from top AI models like GPT, Claude, and Gemini\n----------------------------------------------------\n\nSwitch easily between popular models like OpenAI's GPT, Anthropic's Claude, Google's Gemini, and others to match your workflow.\n\n### Model Selection\n\nChoose your default AI model and configure model-specific settings.\n\n### Custom Settings\n\nSet model-specific options like temperature to fine-tune responses.\n\n### Seamless Switching\n\nSwitch between AI models during chats without losing context.\n\n### Fine-Tuned Control\n\nUse advanced settings to optimize responses for your needs.\n\n![Image 10: models](https://multitaskai.com/_next/image/?url=%2Fscreenshots%2Fmodels-light.png&w=3840&q=75)![Image 11: models](blob:https://multitaskai.com/f5999725ab47d69f901cc1264b98ab0b)\n\nReady to Explore the Full AI Ecosystem?\n---------------------------------------\n\nConnect to OpenRouter and ChatGPT-compatible endpoints to instantly unlock a vast collection of AI models‚Äîfrom industry leaders to innovative open-source pioneers. Whether through OpenRouter or your own endpoints, one key opens up endless possibilities.\n\nMistral Large\n\nOpenAI\n\nAnthropic\n\nGoogle\n\nMeta\n\nClaude 3 Opus\n\nGPT-4 Turbo\n\nMixtral 8x7B\n\nGemini Pro\n\nLlama 2\n\nDeepSeek\n\nQwen 72B\n\nInflection\n\nMistral Large\n\nOpenAI\n\nAnthropic\n\nGoogle\n\nMeta\n\nClaude 3 Opus\n\nGPT-4 Turbo\n\nMixtral 8x7B\n\nGemini Pro\n\nLlama 2\n\nDeepSeek\n\nQwen 72B\n\nInflection\n\nMistral Large\n\nOpenAI\n\nAnthropic\n\nGoogle\n\nMeta\n\nClaude 3 Opus\n\nGPT-4 Turbo\n\nMixtral 8x7B\n\nGemini Pro\n\nLlama 2\n\nDeepSeek\n\nQwen 72B\n\nInflection\n\nMistral Large\n\nOpenAI\n\nAnthropic\n\nGoogle\n\nMeta\n\nClaude 3 Opus\n\nGPT-4 Turbo\n\nMixtral 8x7B\n\nGemini Pro\n\nLlama 2\n\nDeepSeek\n\nQwen 72B\n\nInflection\n\nMicrosoft\n\nAmazon\n\nxAI\n\nCohere\n\nAI21\n\nPerplexity\n\nMistral Medium\n\nClaude 3 Sonnet\n\nGPT-4\n\nGemini Ultra\n\nDeepSeek Coder\n\nQwen 7B\n\nNVIDIA\n\nMicrosoft\n\nAmazon\n\nxAI\n\nCohere\n\nAI21\n\nPerplexity\n\nMistral Medium\n\nClaude 3 Sonnet\n\nGPT-4\n\nGemini Ultra\n\nDeepSeek Coder\n\nQwen 7B\n\nNVIDIA\n\nMicrosoft\n\nAmazon\n\nxAI\n\nCohere\n\nAI21\n\nPerplexity\n\nMistral Medium\n\nClaude 3 Sonnet\n\nGPT-4\n\nGemini Ultra\n\nDeepSeek Coder\n\nQwen 7B\n\nNVIDIA\n\nMicrosoft\n\nAmazon\n\nxAI\n\nCohere\n\nAI21\n\nPerplexity\n\nMistral Medium\n\nClaude 3 Sonnet\n\nGPT-4\n\nGemini Ultra\n\nDeepSeek Coder\n\nQwen 7B\n\nNVIDIA\n\nMistral Small\n\nClaude 3 Haiku\n\nGPT-3.5 Turbo\n\nGemini Nano\n\nLlama 2 70B\n\nMixtral\n\nPalm 2\n\nClaude 2\n\nGPT-4 Vision\n\nTitan\n\nYi 34B\n\nSolar\n\nNous\n\nMistral Small\n\nClaude 3 Haiku\n\nGPT-3.5 Turbo\n\nGemini Nano\n\nLlama 2 70B\n\nMixtral\n\nPalm 2\n\nClaude 2\n\nGPT-4 Vision\n\nTitan\n\nYi 34B\n\nSolar\n\nNous\n\nMistral Small\n\nClaude 3 Haiku\n\nGPT-3.5 Turbo\n\nGemini Nano\n\nLlama 2 70B\n\nMixtral\n\nPalm 2\n\nClaude 2\n\nGPT-4 Vision\n\nTitan\n\nYi 34B\n\nSolar\n\nNous\n\nMistral Small\n\nClaude 3 Haiku\n\nGPT-3.5 Turbo\n\nGemini Nano\n\nLlama 2 70B\n\nMixtral\n\nPalm 2\n\nClaude 2\n\nGPT-4 Vision\n\nTitan\n\nYi 34B\n\nSolar\n\nNous\n\nClaude Instant\n\nVicuna\n\nAlpaca\n\nPythia\n\nFalcon\n\nStarCoder\n\nCode Llama\n\nStable LM\n\nPhi-2\n\nMistral 7B\n\nZephyr\n\nOpenHermes\n\nDolphin\n\nClaude Instant\n\nVicuna\n\nAlpaca\n\nPythia\n\nFalcon\n\nStarCoder\n\nCode Llama\n\nStable LM\n\nPhi-2\n\nMistral 7B\n\nZephyr\n\nOpenHermes\n\nDolphin\n\nClaude Instant\n\nVicuna\n\nAlpaca\n\nPythia\n\nFalcon\n\nStarCoder\n\nCode Llama\n\nStable LM\n\nPhi-2\n\nMistral 7B\n\nZephyr\n\nOpenHermes\n\nDolphin\n\nClaude Instant\n\nVicuna\n\nAlpaca\n\nPythia\n\nFalcon\n\nStarCoder\n\nCode Llama\n\nStable LM\n\nPhi-2\n\nMistral 7B\n\nZephyr\n\nOpenHermes\n\nDolphin\n\nWizardLM\n\nOrca\n\nGuanaco\n\nRedPajama\n\nStableLM\n\nMPT\n\nOpenChat\n\nNeural\n\nPythia\n\nFalcon 180B\n\nLlama 2 13B\n\nMistral 8x7B\n\nYi 6B\n\nWizardLM\n\nOrca\n\nGuanaco\n\nRedPajama\n\nStableLM\n\nMPT\n\nOpenChat\n\nNeural\n\nPythia\n\nFalcon 180B\n\nLlama 2 13B\n\nMistral 8x7B\n\nYi 6B\n\nWizardLM\n\nOrca\n\nGuanaco\n\nRedPajama\n\nStableLM\n\nMPT\n\nOpenChat\n\nNeural\n\nPythia\n\nFalcon 180B\n\nLlama 2 13B\n\nMistral 8x7B\n\nYi 6B\n\nWizardLM\n\nOrca\n\nGuanaco\n\nRedPajama\n\nStableLM\n\nMPT\n\nOpenChat\n\nNeural\n\nPythia\n\nFalcon 180B\n\nLlama 2 13B\n\nMistral 8x7B\n\nYi 6B\n\nNous Hermes\n\nOpenAssistant\n\nDolly\n\nFastChat\n\nH2O\n\nBloom\n\nFlan-T5\n\nCerebras\n\nPaLM\n\nJurassic\n\nClaude 1\n\nKoala\n\nBaichuan\n\nNous Hermes\n\nOpenAssistant\n\nDolly\n\nFastChat\n\nH2O\n\nBloom\n\nFlan-T5\n\nCerebras\n\nPaLM\n\nJurassic\n\nClaude 1\n\nKoala\n\nBaichuan\n\nNous Hermes\n\nOpenAssistant\n\nDolly\n\nFastChat\n\nH2O\n\nBloom\n\nFlan-T5\n\nCerebras\n\nPaLM\n\nJurassic\n\nClaude 1\n\nKoala\n\nBaichuan\n\nNous Hermes\n\nOpenAssistant\n\nDolly\n\nFastChat\n\nH2O\n\nBloom\n\nFlan-T5\n\nCerebras\n\nPaLM\n\nJurassic\n\nClaude 1\n\nKoala\n\nBaichuan\n\nPay Only for What You Use with Your Own API Keys\n------------------------------------------------\n\nConnect your own API keys from OpenAI, Anthropic, or Google to maintain full control over costs. With direct API access, you'll only pay for the messages you actually send‚Äîno hidden fees or markups.\n\nOpenAI\n\nModel: GPT-4o\n\nCost per Token:\n\nInput: $0.0025/1K tokens  \nOutput: $0.01/1K tokens\n\nExample cost:\n\n100 messages (~400 tokens each)$2.87\n\nAnthropic\n\nModel: Claude 3.5 Sonnet\n\nCost per Token:\n\nInput: $0.003/1K tokens  \nOutput: $0.015/1K tokens\n\nExample cost:\n\n100 messages (~400 tokens each)$4.20\n\nGoogle\n\nModel: Gemini 1.5 Flash\n\nCost per Token:\n\nInput: $0.000075/1K tokens  \nOutput: $0.0003/1K tokens\n\nExample cost:\n\n100 messages (~400 tokens each)$0.086\n\n\\* Pricing information is based on public data as of January 2025. Actual costs may vary. Please check the provider's website for current pricing.\n\nCombine Agents and Files in the Message Input\n---------------------------------------------\n\nAdd multiple agents and attach files to your input in one message, simplifying combinations and enhancing context. Agents can also fetch dynamic context from external sources at runtime, providing up-to-date information for your conversations.\n\n![Image 12: input](https://multitaskai.com/_next/image/?url=%2Fscreenshots%2Finput-light.png&w=3840&q=75)![Image 13: input](blob:https://multitaskai.com/f5999725ab47d69f901cc1264b98ab0b)\n\nImage Analysis for Vision-Enabled Models\n----------------------------------------\n\nShare images with models that support vision‚Äîlike GPT-4, Claude 3, or Gemini Pro Vision‚Äîand get quick insights on screenshots, diagrams, and more.\n\n![Image 14: vision](https://multitaskai.com/_next/image/?url=%2Fscreenshots%2Fvision-light.png&w=3840&q=75)![Image 15: vision](blob:https://multitaskai.com/f5999725ab47d69f901cc1264b98ab0b)\n\nAudio Transcription with Whisper\n--------------------------------\n\nConvert speech to text seamlessly using OpenAI's Whisper model running locally in your browser. Transcribe audio from your microphone or upload audio files to include in your conversations.\n\n![Image 16: whisper](https://multitaskai.com/_next/image/?url=%2Fscreenshots%2Fwhisper-light.png&w=3840&q=75)![Image 17: whisper](blob:https://multitaskai.com/f5999725ab47d69f901cc1264b98ab0b)\n\nOptimized for Mobile with PWA Support\n-------------------------------------\n\nUse the app anywhere with PWA functionality and a responsive design. Enjoy an app-like experience on both desktop and mobile, with offline support for productivity on the go.\n\n![Image 18: chat mobile](https://multitaskai.com/_next/image/?url=%2Fscreenshots%2Fchat-mobile-light.png&w=750&q=75)![Image 19: chat mobile](blob:https://multitaskai.com/79b69fcf9c4d3656bd816d22f2ba120c)\n\n![Image 20: models mobile](https://multitaskai.com/_next/image/?url=%2Fscreenshots%2Fchat-models-mobile-light.png&w=750&q=75)![Image 21: models mobile](blob:https://multitaskai.com/79b69fcf9c4d3656bd816d22f2ba120c)\n\n![Image 22: files mobile](https://multitaskai.com/_next/image/?url=%2Fscreenshots%2Ffiles-mobile-light.png&w=750&q=75)![Image 23: files mobile](blob:https://multitaskai.com/79b69fcf9c4d3656bd816d22f2ba120c)\n\nSync Your Data Across Devices with Google Drive\n-----------------------------------------------\n\nKeep your conversations, agents, and settings in sync across all your devices. Securely back up and restore your data using your Google Drive account while maintaining complete privacy. Note: Google Drive sync is not available for self-hosted instances.\n\nSmart Prompts with Dynamic Variables\n------------------------------------\n\nUse flexible prompts with %variable% detection to create dynamic and adaptive conversations.\n\n![Image 24: prompts](https://multitaskai.com/_next/image/?url=%2Fscreenshots%2Fprompts-light.png&w=3840&q=75)![Image 25: prompts](blob:https://multitaskai.com/f5999725ab47d69f901cc1264b98ab0b)\n\nGenerate System Instructions and Agents\n---------------------------------------\n\nUse LLMs to generate agents and system instructions‚Äîlike an LLM imagining its own helpers. Customize workflows with this AI-powered inception tool in the settings.\n\n![Image 26: inline generation](https://multitaskai.com/_next/image/?url=%2Fscreenshots%2Finline-generation-light.png&w=3840&q=75)![Image 27: inline generation](blob:https://multitaskai.com/f5999725ab47d69f901cc1264b98ab0b)\n\nAvailable in 29 Languages\n-------------------------\n\nSwitch to Korean, German, Spanish, or any of the other supported languages without losing advanced features. Stay productive in the language you prefer.\n\nüá∏üá¶\n\nüáßüá¨\n\nüá®üáø\n\nüá©üá∞\n\nüá©üá™\n\nüá¨üá∑\n\nüá¨üáß\n\nüá™üá∏\n\nüá™üá™\n\nüá´üáÆ\n\nüá´üá∑\n\nüá≠üá∫\n\nüáÆüá©\n\nüáÆüáπ\n\nüáØüáµ\n\nüá∞üá∑\n\nüá±üáπ\n\nüá±üáª\n\nüá≥üá±\n\nüáµüá±\n\nüáµüáπ\n\nüá∑üá¥\n\nüá∏üá∞\n\nüá∏üáÆ\n\nüá∏üá™\n\nüáπüá∑\n\nüá∫üá¶\n\nüá®üá≥\n\nSelf-host MultitaskAI anywhere with static hosting\n--------------------------------------------------\n\nDeploy anywhere that serves static files‚Äîeven traditional FTP hosting works! No backend needed‚Äîjust download, unzip, and host for complete control over your data.\n\nTiiny Host\n\nGitHub Pages\n\nNetlify\n\nCloudflare Pages\n\nVercel\n\nNeocities\n\nFirebase Hosting\n\nAzure Static Web Apps\n\nTiiny Host\n\nGitHub Pages\n\nNetlify\n\nCloudflare Pages\n\nVercel\n\nNeocities\n\nFirebase Hosting\n\nAzure Static Web Apps\n\nTiiny Host\n\nGitHub Pages\n\nNetlify\n\nCloudflare Pages\n\nVercel\n\nNeocities\n\nFirebase Hosting\n\nAzure Static Web Apps\n\nTiiny Host\n\nGitHub Pages\n\nNetlify\n\nCloudflare Pages\n\nVercel\n\nNeocities\n\nFirebase Hosting\n\nAzure Static Web Apps\n\nFirebase Hosting\n\nAzure Static Web Apps\n\nAWS Amplify\n\nRender\n\nGitLab Pages\n\nBitbucket Pages\n\nFleek\n\nDigitalOcean App Platform\n\nFirebase Hosting\n\nAzure Static Web Apps\n\nAWS Amplify\n\nRender\n\nGitLab Pages\n\nBitbucket Pages\n\nFleek\n\nDigitalOcean App Platform\n\nFirebase Hosting\n\nAzure Static Web Apps\n\nAWS Amplify\n\nRender\n\nGitLab Pages\n\nBitbucket Pages\n\nFleek\n\nDigitalOcean App Platform\n\nFirebase Hosting\n\nAzure Static Web Apps\n\nAWS Amplify\n\nRender\n\nGitLab Pages\n\nBitbucket Pages\n\nFleek\n\nDigitalOcean App Platform\n\nFleek\n\nDigitalOcean App Platform\n\nGlitch\n\nBegin\n\nDeta Space\n\nHeroku\n\nFly.io\n\nStormkit\n\nFleek\n\nDigitalOcean App Platform\n\nGlitch\n\nBegin\n\nDeta Space\n\nHeroku\n\nFly.io\n\nStormkit\n\nFleek\n\nDigitalOcean App Platform\n\nGlitch\n\nBegin\n\nDeta Space\n\nHeroku\n\nFly.io\n\nStormkit\n\nFleek\n\nDigitalOcean App Platform\n\nGlitch\n\nBegin\n\nDeta Space\n\nHeroku\n\nFly.io\n\nStormkit\n\nFly.io\n\nStormkit\n\nTiiny Host\n\nGitHub Pages\n\nNetlify\n\nCloudflare Pages\n\nFly.io\n\nStormkit\n\nTiiny Host\n\nGitHub Pages\n\nNetlify\n\nCloudflare Pages\n\nFly.io\n\nStormkit\n\nTiiny Host\n\nGitHub Pages\n\nNetlify\n\nCloudflare Pages\n\nFly.io\n\nStormkit\n\nTiiny Host\n\nGitHub Pages\n\nNetlify\n\nCloudflare Pages\n\nOther Features at a Glance\n--------------------------\n\n### Import\n\nLoad your entire setup, including chats, files, configurations, and preferences, from a JSON file to continue exactly where you left off.\n\n### Export\n\nSave your entire workspace, including chats, files, and settings, into a JSON file for easy backup or sharing.\n\n### Light/Dark Mode\n\nSwitch between light and dark themes to match your environment and enhance usability.\n\n### File Parsing\n\nExtract and process content from various file types, including text documents and images.\n\n### Multi-Agent Chat\n\nConverse with multiple AI agents at the same time to tackle complex tasks and explore different perspectives.\n\n### Advanced Context Menu\n\nAccess powerful slash commands and shortcuts, inspired by Notion, to navigate and interact with ease.\n\n### Upload Files via Drag and Drop\n\nEasily upload files by dragging and dropping them directly into the app, making file handling more seamless.\n\n### Browser-Based\n\nThis is a fully browser-based app, ensuring all data remains secure and private. No data is sent to third parties, except for interactions with the APIs you configure.\n\n### Keyboard Shortcuts\n\nStreamline your workflow with customizable keyboard shortcuts for quick access to features and commands.\n\n### Text-to-Speech\n\nTransform your chat experience with natural voice output. Perfect for multitasking or accessibility needs.\n\n### Stop Generating\n\nTake full control of your conversations with instant message generation stopping. Save time and stay focused.\n\n### Rename and Duplicate\n\nKeep your chat history organized with duplication and/or renaming. Never lose track of important conversations.\n\n### System Information\n\nMonitor storage usage, memory consumption, and system performance directly from the interface.\n\n### Auto-scroll Options\n\nCustomize how chat messages scroll and stay in view with flexible auto-scroll settings.\n\n### Encrypted API Keys\n\nYour API keys are securely encrypted in storage for enhanced security and peace of mind.\n\n### LaTeX Support\n\nWrite and render mathematical equations and scientific notation with built-in LaTeX support.\n\n### Collapsible Sidebar\n\nMaximize your workspace with a fully collapsible sidebar for better focus and screen management.\n\n### Chat Branching\n\nCreate multiple conversation branches from any point to explore different directions and ideas.\n\nGet started with your lifetime license\n--------------------------------------\n\nEnjoy unlimited conversations with MultitaskAI and unlock the full potential of cutting-edge language models‚Äîall with a one-time lifetime license.\n\n#### What's included\n\n*   5 activations\n*   Lifetime updates\n*   PWA support for offline usage\n*   Self-hosted option for privacy and security\n\nüéâ Special launch offer applied at checkout. (-50 EUR)\n\n‚Ç¨149EUR\n\n‚Ç¨99EUR\n\n[Get Started](https://earlybird.so/products/multitaskai/)‚ôæÔ∏è Lifetime License\n\nRoadmap\n-------\n\nWe've got big upcoming features that will supercharge your productivity‚Äîwhether you need multiple languages, prefer local models, or want to sync your data seamlessly. Here's what's next:\n\n### Google Drive Sync\n\nGoogle Drive syncing is nearly ready, pending final approval from Google. Soon, you'll be able to securely sync and share your data across multiple devices.\n\n### OpenRouter & ChatGPT-compatible Endpoints\n\nConnect to OpenRouter or ChatGPT-compatible endpoints to extend the app's AI capabilities and work with additional providers or custom solutions.\n\n### Audio Parsing\n\nUpload audio clips for automatic transcription. The resulting text can be referenced in chats, attached to agents, or used anywhere else you need AI-driven context.\n\n### Multi language support\n\nWe're introducing full multilingual capabilities so you can easily switch the entire interface to your preferred language.\n\n### Plugins\n\nInstall or generate custom plugins with built-in LLM prompts, enabling new and specialized features that expand your AI toolkit.\n\n### Chrome Extension\n\nBring MultitaskAI wherever you browse. Our upcoming Chrome extension lets you interact with AI directly on any webpage.\n\n### Visual Prompt Canvas\n\nDesign prompts and content generation flows visually with a Figma-like canvas interface. Create complex AI workflows by connecting nodes, managing data flow, and visualizing your prompt engineering process‚Äîall in an intuitive drag-and-drop environment.\n\n### Desktop App\n\nEnjoy a dedicated desktop version that supports local models for enhanced privacy while also working seamlessly with your chosen cloud-based LLM providers.\n\nFAQ\n---\n\n### \n\n### What is MultitaskAI?\n\nMultitaskAI is a powerful AI-powered chat application that allows you to connect with AI models like ChatGPT, Claude, and GPT-4, all in one place. With MultitaskAI, you can easily create and manage multiple chats, agents, and prompts, all from one interface. Whether you're looking for a quick and easy way to chat with AI or want to take your conversations to the next level, MultitaskAI has got you covered.\n\n### \n\n### How does MultitaskAI actually work?\n\nMultitaskAI runs entirely in your browser, using your own API keys to connect with AI models. There are no extra subscriptions beyond any usage fees from your AI provider. You're in full control of your data and usage.\n\n### \n\n### Do I need any coding skills to use MultitaskAI effectively?\n\nNot at all. MultitaskAI is designed to be accessible for non-technical users while offering advanced settings for those who want deeper control. The documentation provides step-by-step guidance for setting up API keys, chats, and agents.\n\n### \n\n### What's the difference between Chats, Agents, and Files?\n\nChats are where you send messages and receive AI responses. Agents are specialized configurations with custom instructions, files, and model settings. Files are documents or images you upload for context. Each plays a unique role in how you communicate with AI.\n\n### \n\n### How much does a MultitaskAI license cost?\n\nMultitaskAI is available for a one-time lifetime purchase, which includes 5 device activations. There are no recurring monthly or annual fees, making it a cost-effective way to chat with the top AI models.\n\n### \n\n### Are there any monthly or hidden fees beyond buying the license?\n\nNo. You only need to provide your own API keys from providers like OpenAI or Anthropic, which may charge usage fees. MultitaskAI itself requires no further subscription after purchasing a lifetime license.\n\n### \n\n### Do I need to bring my own API keys?\n\nYes, you will need to provide your own API keys for models like OpenAI's GPT, Anthropic's Claude, and others. MultitaskAI simply sends your requests to these model providers, and no other subscriptions or fees are required from us.\n\n### \n\n### Can I test MultitaskAI before purchasing?\n\nYes. You can try the app with 100% functionality in demo mode at [app.multitaskai.com](https://app.multitaskai.com/). Your data will reset when you restart, but it lets you fully explore all features before buying a license.\n\n### \n\n### What happens if I use all 5 device activations?\n\nYour license includes 5 device activations by default. If you max out your activations, you can free up a slot by deactivating an existing device or purchase an additional license for 5 more activations.\n\n### \n\n### How can I manage or revoke my licenses?\n\nYou can manage or remove device activations from the dashboard at multitaskai.com/account. After signing in, go to 'License' where you can review active devices and remove any that you no longer need.\n\n### \n\n### Is my license key sensitive information?\n\nYes, treat your license key like a password. Store it securely and never share it publicly to prevent unauthorized usage of your activations.\n\n### \n\n### Where is my chat data stored?\n\nYour sessions and conversation data are stored locally in your browser. We do not store or process your chats on external servers, ensuring that your data remains private.\n\n### \n\n### Does MultitaskAI work offline or in low-connectivity environments?\n\nYes. MultitaskAI supports Progressive Web App (PWA) installation so you can use key features, like viewing your past locally stored data, even without an active internet connection.\n\n### \n\n### Does MultitaskAI update automatically?\n\nYes. As a fully browser-based application hosted at [app.multitaskai.com](https://app.multitaskai.com/), MultitaskAI updates automatically. Whenever we release new features or improvements, simply refresh your browser to get the latest version.\n\n### \n\n### How do I self-host MultitaskAI?\n\nWith your purchase, you gain the option to self-host the application for added privacy and control. Simply download the source files from the official website, follow the installation instructions in our documentation, and deploy the app on your own server or preferred hosting platform.\n\n### \n\n### How do I reset my password?\n\nIf you forget your password, click the 'Reset Password' link on the Login screen at multitaskai.com/login. You'll receive a reset link via email to choose a new password.\n\n### \n\n### Who can I contact for troubleshooting or support?\n\nIf you have questions or need help, please email [hi@multitaskai.com](mailto:hi@multitaskai.com). Our team will gladly assist you. We do not currently offer a forum or community board.\n\nStay up to date with MultitaskAI\n--------------------------------\n\nNo spam, no nonsense. Pinky promise.\n\nSubscribe\n\n![Image 28: logo](https://multitaskai.com/_next/image/?url=%2Fimages%2Flogo.png&w=3840&q=75)\n\n[Pricing](https://multitaskai.com/pricing/)‚Ä¢[Legal](https://multitaskai.com/legal/)‚Ä¢[Blog](https://multitaskai.com/blog/)‚Ä¢[Redeem Code](https://multitaskai.com/redeem-code/)‚Ä¢[Account](https://multitaskai.com/login/)\n\n### Alternatives\n\n*   [The Ultimate ChatGPT Alternative (2025)](https://multitaskai.com/chatgpt-alternative/)\n*   [The Ultimate Claude Alternative (2025)](https://multitaskai.com/claude-alternative/)\n*   [The Ultimate Google Gemini Alternative (2025)](https://multitaskai.com/google-gemini-alternative/)\n\n### Self-hosting\n\n*   [The Best Self-hosted ChatGPT Alternative (2025)](https://multitaskai.com/self-hosted-chatgpt/)\n*   [The Best Self-hosted Claude Alternative (2025)](https://multitaskai.com/self-hosted-claude/)\n*   [The Best Self-hosted Google Gemini Alternative (2025)](https://multitaskai.com/self-hosted-google-gemini/)\n\n### By [dennn.is](https://dennn.is/)\n\n¬© 2025\n\n[‚ìÇÔ∏è #### MultitaskAI A unified chat UI for leading AI models](https://multitaskai.com/)[üîÆ #### Blockstudio The block framework for WordPress](https://blockstudio.dev/)[ü•∑ #### SleekWP Comprehensive product suite for WordPress](https://sleekwp.com/)[‚ùáÔ∏è #### OneClick Pro The ultimate collection of single-click tools](https://oneclick.pro/)[üí† #### KickstartUI Your ultimate guide to the best UI tools](https://kickstartui.com/)[üç© #### Glaze Utility-based animation framework for the web](https://glaze.dev/)",
    "usage": {
      "tokens": 6750
    }
  }
}